<?xml version="1.0" encoding="UTF-8" standalone="yes"?>
<serializations xmlns="http://schema.localmatters.org/serializations" xmlns:xsi="http://www.w3.org/2001/XMLSchema-instance" xsi:schemaLocation="http://schema.localmatters.org/serializations http://schema.localmatters.org/serializations.xsd">

    <!-- org.localmatters.serializer.test.domain.ObjectWithGenerics -->
    <complex id="ObjectWithGenerics" bean="ObjectWithGenerics" name="ObjectWithGenerics">
        <list property="array"/>

        <!-- Unable to identify the types for the [list] iteration!
             The configuration of its elements must be written manually. -->
        <list property="list">
            <value name="element"/>
        </list>

        <!-- Iteration of [java.util.List<java.lang.String>] -->
        <list property="listOfListOfString">
            <list name="element"/>
        </list>

        <!-- Iteration of [java.util.Map<java.lang.String, java.util.List>] -->
        <list property="listOfMapOfStringAndList">

            <!-- map of [class java.lang.String] and [interface java.util.List] -->
            <map name="listOfMapOfStringAnd">

                <!-- Unable to identify the types for the [entry] iteration!
                     The configuration of its elements must be written manually. -->
                <list>
                    <value name="element"/>
                </list>
            </map>
        </list>

        <!-- Iteration of [class org.localmatters.serializer.test.domain.ParameterizedObject] -->
        <list property="listOfParameterizedObject">
            <list name="element"/>
        </list>
        <list property="listOfString"/>

        <!-- Configured the complex map returned by [map] as a list.
             This can change to a <map> by setting its [key] attribute to the
             property of the key object that identifies it. -->
        <list property="map">
            <complex name="entry">

                <!-- Unable to resolve the class for the element [key]!
                     Its configuration must be written manually. -->
                <value property="key"/>

                <!-- Unable to resolve the class for the element [value]!
                     Its configuration must be written manually. -->
                <value property="value"/>
            </complex>
        </list>
        <map property="mapOfStringAndDouble"/>
    </complex>

    <!-- org.localmatters.serializer.test.domain.DummyObject -->
    <complex id="org.localmatters.serializer.test.domain.DummyObject" bean="DummyObject" name="DummyObject">

        <!-- map of [class java.lang.String] and [class org.localmatters.serializer.test.domain.DummyObject$Address] -->
        <map property="addresses">
            <ref target="Address"/>
        </map>

        <!-- Unable to identify the types for the [addressesRaw] map!
             The configuration of its entries must be written manually. -->
        <map property="addressesRaw"/>
        <value property="id"/>
        <value property="name"/>
        <list property="orders"/>

        <!-- Configured the complex map returned by [ordersByAddresses] as a list.
             This can change to a <map> by setting its [key] attribute to the
             property of the key object that identifies it. -->
        <list property="ordersByAddresses">
            <complex name="ordersByAddress">
                <ref property="key" target="Address"/>
                <list property="value"/>
            </complex>
        </list>
        <list property="ordersList"/>
    </complex>

    <!-- org.localmatters.serializer.test.domain.extra.DummyObject -->
    <complex id="DummyObject" bean="DummyObject" name="DummyObject">
        <ref property="dummy" target="org.localmatters.serializer.test.domain.DummyObject"/>
    </complex>

    <!-- org.localmatters.serializer.test.domain.ChildOfSelfreferencingObject -->
    <complex id="ChildOfSelfreferencingObject" bean="ChildOfSelfreferencingObject" name="ChildOfSelfreferencingObject">
        <value property="name"/>

        <!-- Iteration of [class org.localmatters.serializer.test.domain.SelfReferencingObject] -->
        <list property="others">
            <ref name="other" target="SelfReferencingObject"/>
        </list>
    </complex>

    <!-- org.localmatters.serializer.test.domain.SelfReferencingObject -->
    <complex id="SelfReferencingObject" name="SelfReferencingObject">
        <value property="name"/>

        <!-- Iteration of [class org.localmatters.serializer.test.domain.SelfReferencingObject] -->
        <list property="others">
            <ref name="other" target="SelfReferencingObject"/>
        </list>
    </complex>

    <!-- org.localmatters.serializer.test.domain.DummyObject$Address -->
    <complex id="Address" name="Address">
        <value property="city"/>
        <value property="state"/>
        <value property="street"/>
        <value property="z"/>
        <value property="zip"/>
    </complex>
</serializations>